id;name;status;landingUrl;coverImageUrl;createdAt
480;HomePro Electronics Autumn Price Drop – Week 21 (ES) 2025;0;https://example.com/campaigns/480;https://example.com/images/campaign-480.jpg;2025-08-01 06:46:25
481;BuildIt Pets Spring New Arrivals – Week 38 (UK) 2025;0;https://example.com/campaigns/481;https://example.com/images/campaign-481.jpg;2026-09-06 21:58:32
482;DailySave Home & Living Summer Mega Savings – Week 5 (UK) 2026;1;https://example.com/campaigns/482;https://example.com/images/campaign-482.jpg;2026-07-30 16:23:31
483;StyleHub Electronics Winter Mega Savings – Week 36 (NL) 2025;0;https://example.com/campaigns/483;https://example.com/images/campaign-483.jpg;2025-12-21 22:08:37
484;SportZone Grocery Spring Limited Time – Week 35 (PL) 2026;1;https://example.com/campaigns/484;https://example.com/images/campaign-484.jpg;2025-03-23 00:36:07
485;BuildIt Pets Winter Clearance – Week 45 (AT) 2025;1;https://example.com/campaigns/485;https://example.com/images/campaign-485.jpg;2025-10-05 00:38:51
486;SportZone Fashion Spring Clearance – Week 36 (AT) 2026;0;https://example.com/campaigns/486;https://example.com/images/campaign-486.jpg;2025-01-16 09:38:43
487;SportZone Pharmacy Spring New Arrivals – Week 8 (FR) 2025;1;https://example.com/campaigns/487;https://example.com/images/campaign-487.jpg;2026-06-06 14:29:22
488;PetPal Pets Autumn New Arrivals – Week 40 (NL) 2026;1;https://example.com/campaigns/488;https://example.com/images/campaign-488.jpg;2026-06-03 18:07:39
489;HomePro DIY Winter New Arrivals – Week 33 (IT) 2025;1;https://example.com/campaigns/489;https://example.com/images/campaign-489.jpg;2025-01-31 22:10:18
490;TechWorld Fashion Summer Member Offer – Week 16 (FR) 2025;0;https://example.com/campaigns/490;https://example.com/images/campaign-490.jpg;2026-01-14 16:29:13
491;HomePro Sports Winter New Arrivals – Week 5 (CH) 2026;0;https://example.com/campaigns/491;https://example.com/images/campaign-491.jpg;2025-05-16 06:37:08
492;SportZone DIY Spring Member Offer – Week 47 (NL) 2025;1;https://example.com/campaigns/492;https://example.com/images/campaign-492.jpg;2026-06-11 20:38:31
493;FreshMart Sports Spring Weekend Deals – Week 4 (FR) 2025;0;https://example.com/campaigns/493;https://example.com/images/campaign-493.jpg;2026-11-18 18:57:18
494;StyleHub DIY Summer Flash Sale – Week 41 (FR) 2025;1;https://example.com/campaigns/494;https://example.com/images/campaign-494.jpg;2025-02-08 13:08:59
495;BuildIt Home & Living Autumn Mega Savings – Week 52 (UK) 2025;0;https://example.com/campaigns/495;https://example.com/images/campaign-495.jpg;2025-02-05 19:00:09
496;BuildIt Pharmacy Spring Weekend Deals – Week 23 (IT) 2025;1;https://example.com/campaigns/496;https://example.com/images/campaign-496.jpg;2026-05-18 04:57:08
497;BuildIt Grocery Spring New Arrivals – Week 26 (CH) 2026;0;https://example.com/campaigns/497;https://example.com/images/campaign-497.jpg;2025-12-18 17:51:35
498;TechWorld Grocery Summer Clearance – Week 42 (IT) 2026;0;https://example.com/campaigns/498;https://example.com/images/campaign-498.jpg;2026-10-15 20:32:20
499;StyleHub Grocery Spring Mega Savings – Week 41 (DE) 2025;1;https://example.com/campaigns/499;https://example.com/images/campaign-499.jpg;2025-07-07 09:24:29
500;SportZone Grocery Spring Flash Sale – Week 18 (FR) 2025;0;https://example.com/campaigns/500;https://example.com/images/campaign-500.jpg;2025-05-17 09:01:39
501;SportZone Grocery Spring Weekend Deals – Week 52 (CH) 2025;1;https://example.com/campaigns/501;https://example.com/images/campaign-501.jpg;2026-07-26 19:06:01
502;FreshMart Grocery Autumn Weekend Deals – Week 46 (UK) 2026;1;https://example.com/campaigns/502;https://example.com/images/campaign-502.jpg;2026-09-08 09:11:19
503;StyleHub Pets Spring Hot Picks – Week 51 (CH) 2025;1;https://example.com/campaigns/503;https://example.com/images/campaign-503.jpg;2026-06-19 09:07:39
504;DailySave Sports Autumn Mega Savings – Week 46 (NL) 2025;1;https://example.com/campaigns/504;https://example.com/images/campaign-504.jpg;2026-10-24 13:44:00
505;SportZone Pets Autumn New Arrivals – Week 45 (IT) 2025;1;https://example.com/campaigns/505;https://example.com/images/campaign-505.jpg;2026-02-13 17:36:56
506;HomePro Pets Summer Mega Savings – Week 2 (SE) 2026;1;https://example.com/campaigns/506;https://example.com/images/campaign-506.jpg;2026-01-09 23:32:01
507;SportZone Beauty Autumn Price Drop – Week 52 (NL) 2025;0;https://example.com/campaigns/507;https://example.com/images/campaign-507.jpg;2026-04-23 00:19:08
508;TechWorld Fashion Spring Flash Sale – Week 51 (AT) 2026;0;https://example.com/campaigns/508;https://example.com/images/campaign-508.jpg;2025-01-25 01:45:11
509;TechWorld Home & Living Autumn Flash Sale – Week 48 (CH) 2026;1;https://example.com/campaigns/509;https://example.com/images/campaign-509.jpg;2025-11-24 00:26:16
510;BeautyBox Home & Living Spring Price Drop – Week 16 (ES) 2026;1;https://example.com/campaigns/510;https://example.com/images/campaign-510.jpg;2026-01-16 13:04:20
511;PetPal Fashion Spring Price Drop – Week 6 (AT) 2026;1;https://example.com/campaigns/511;https://example.com/images/campaign-511.jpg;2025-12-20 00:55:26
512;MarketPlus DIY Winter Flash Sale – Week 17 (UK) 2026;1;https://example.com/campaigns/512;https://example.com/images/campaign-512.jpg;2026-11-14 05:42:12
513;DailySave Pets Autumn Hot Picks – Week 12 (SE) 2025;0;https://example.com/campaigns/513;https://example.com/images/campaign-513.jpg;2026-10-10 11:12:23
514;FreshMart Fashion Summer New Arrivals – Week 9 (IT) 2026;0;https://example.com/campaigns/514;https://example.com/images/campaign-514.jpg;2026-05-21 03:29:44
515;PetPal Beauty Autumn Flash Sale – Week 32 (IT) 2026;1;https://example.com/campaigns/515;https://example.com/images/campaign-515.jpg;2025-01-04 03:56:57
516;TechWorld DIY Winter Hot Picks – Week 30 (SE) 2026;1;https://example.com/campaigns/516;https://example.com/images/campaign-516.jpg;2025-01-27 03:38:10
517;FreshMart Electronics Spring Hot Picks – Week 39 (FR) 2026;0;https://example.com/campaigns/517;https://example.com/images/campaign-517.jpg;2026-11-21 17:18:57
518;StyleHub Fashion Autumn Weekend Deals – Week 28 (DE) 2025;1;https://example.com/campaigns/518;https://example.com/images/campaign-518.jpg;2025-08-06 13:57:50
519;MarketPlus Beauty Summer New Arrivals – Week 7 (PL) 2026;1;https://example.com/campaigns/519;https://example.com/images/campaign-519.jpg;2026-01-24 15:59:36
520;HomePro Home & Living Summer Mega Savings – Week 13 (CH) 2025;0;https://example.com/campaigns/520;https://example.com/images/campaign-520.jpg;2025-04-21 06:06:11
521;BuildIt Home & Living Summer Mega Savings – Week 52 (NL) 2026;1;https://example.com/campaigns/521;https://example.com/images/campaign-521.jpg;2026-01-03 21:41:47
522;DailySave Fashion Spring Member Offer – Week 34 (DE) 2026;0;https://example.com/campaigns/522;https://example.com/images/campaign-522.jpg;2026-03-11 19:46:42
523;HomePro DIY Spring Limited Time – Week 44 (UK) 2026;1;https://example.com/campaigns/523;https://example.com/images/campaign-523.jpg;2025-10-16 22:44:01
524;TechWorld DIY Summer Member Offer – Week 46 (AT) 2025;0;https://example.com/campaigns/524;https://example.com/images/campaign-524.jpg;2026-12-16 06:45:02
525;TechWorld Fashion Summer Weekend Deals – Week 2 (ES) 2025;1;https://example.com/campaigns/525;https://example.com/images/campaign-525.jpg;2026-10-23 17:15:01
526;HomePro Electronics Winter Weekend Deals – Week 14 (ES) 2025;1;https://example.com/campaigns/526;https://example.com/images/campaign-526.jpg;2025-02-13 04:38:00
527;StyleHub Pharmacy Summer Mega Savings – Week 41 (PL) 2026;1;https://example.com/campaigns/527;https://example.com/images/campaign-527.jpg;2025-04-24 02:00:06
528;DailySave Pharmacy Summer Member Offer – Week 2 (UK) 2026;0;https://example.com/campaigns/528;https://example.com/images/campaign-528.jpg;2026-12-31 10:21:57
529;BeautyBox DIY Summer Clearance – Week 12 (NL) 2025;1;https://example.com/campaigns/529;https://example.com/images/campaign-529.jpg;2025-02-23 23:31:26
530;MarketPlus Grocery Summer Price Drop – Week 51 (DE) 2025;0;https://example.com/campaigns/530;https://example.com/images/campaign-530.jpg;2026-05-16 04:30:37
531;DailySave Pharmacy Spring Clearance – Week 47 (PL) 2026;1;https://example.com/campaigns/531;https://example.com/images/campaign-531.jpg;2025-11-11 04:47:28
532;TechWorld Pharmacy Summer New Arrivals – Week 45 (IT) 2026;0;https://example.com/campaigns/532;https://example.com/images/campaign-532.jpg;2025-04-11 18:23:33
533;MarketPlus Electronics Autumn New Arrivals – Week 38 (NL) 2026;1;https://example.com/campaigns/533;https://example.com/images/campaign-533.jpg;2025-06-03 13:13:48
534;MarketPlus Electronics Spring Limited Time – Week 45 (UK) 2026;1;https://example.com/campaigns/534;https://example.com/images/campaign-534.jpg;2025-01-19 02:23:13
535;StyleHub Sports Winter Clearance – Week 39 (DE) 2025;0;https://example.com/campaigns/535;https://example.com/images/campaign-535.jpg;2025-10-02 07:27:25
536;DailySave Pharmacy Autumn Clearance – Week 41 (PL) 2026;1;https://example.com/campaigns/536;https://example.com/images/campaign-536.jpg;2026-12-14 18:01:35
537;BeautyBox Electronics Summer Price Drop – Week 23 (SE) 2025;1;https://example.com/campaigns/537;https://example.com/images/campaign-537.jpg;2026-06-29 03:46:58
538;DailySave DIY Autumn New Arrivals – Week 48 (PL) 2026;0;https://example.com/campaigns/538;https://example.com/images/campaign-538.jpg;2025-11-23 00:05:16
539;MarketPlus Sports Autumn Price Drop – Week 10 (AT) 2025;1;https://example.com/campaigns/539;https://example.com/images/campaign-539.jpg;2026-03-09 08:33:09
540;DailySave Pharmacy Spring Clearance – Week 47 (PL) 2026;1;https://example.com/campaigns/540;https://example.com/images/campaign-540.jpg;2025-07-31 02:27:30
541;MarketPlus Beauty Winter Hot Picks – Week 10 (IT) 2025;1;https://example.com/campaigns/541;https://example.com/images/campaign-541.jpg;2025-11-21 22:53:29
542;MarketPlus Beauty Winter Limited Time – Week 31 (CH) 2026;1;https://example.com/campaigns/542;https://example.com/images/campaign-542.jpg;2026-02-02 07:32:10
543;MarketPlus Electronics Spring Weekend Deals – Week 31 (NL) 2025;1;https://example.com/campaigns/543;https://example.com/images/campaign-543.jpg;2025-09-21 09:53:25
544;BuildIt Grocery Summer Price Drop – Week 2 (NL) 2026;1;https://example.com/campaigns/544;https://example.com/images/campaign-544.jpg;2026-04-27 07:42:44
545;DailySave Pets Autumn New Arrivals – Week 19 (ES) 2026;1;https://example.com/campaigns/545;https://example.com/images/campaign-545.jpg;2026-08-06 18:50:12
546;StyleHub Pets Autumn Member Offer – Week 49 (ES) 2026;0;https://example.com/campaigns/546;https://example.com/images/campaign-546.jpg;2025-06-18 03:10:53
547;MarketPlus Fashion Autumn Limited Time – Week 5 (DE) 2026;0;https://example.com/campaigns/547;https://example.com/images/campaign-547.jpg;2026-05-20 21:52:32
548;BeautyBox Sports Summer Mega Savings – Week 51 (SE) 2026;1;https://example.com/campaigns/548;https://example.com/images/campaign-548.jpg;2026-10-06 03:28:49
549;FreshMart Pharmacy Winter Limited Time – Week 31 (PL) 2025;0;https://example.com/campaigns/549;https://example.com/images/campaign-549.jpg;2026-03-07 12:27:39
550;MarketPlus Fashion Summer Flash Sale – Week 40 (AT) 2025;1;https://example.com/campaigns/550;https://example.com/images/campaign-550.jpg;2026-05-30 18:09:59
551;BeautyBox DIY Spring Price Drop – Week 2 (SE) 2026;0;https://example.com/campaigns/551;https://example.com/images/campaign-551.jpg;2026-06-06 05:35:48
552;StyleHub Electronics Winter Flash Sale – Week 44 (SE) 2025;0;https://example.com/campaigns/552;https://example.com/images/campaign-552.jpg;2026-11-16 12:08:13
553;BeautyBox Home & Living Spring Member Offer – Week 3 (IT) 2025;0;https://example.com/campaigns/553;https://example.com/images/campaign-553.jpg;2026-09-14 19:03:51
554;PetPal Pets Spring Mega Savings – Week 20 (FR) 2026;1;https://example.com/campaigns/554;https://example.com/images/campaign-554.jpg;2026-03-24 17:05:50
555;TechWorld Fashion Autumn Weekend Deals – Week 40 (FR) 2025;1;https://example.com/campaigns/555;https://example.com/images/campaign-555.jpg;2025-08-14 08:55:27
556;StyleHub Grocery Summer Limited Time – Week 32 (IT) 2026;1;https://example.com/campaigns/556;https://example.com/images/campaign-556.jpg;2026-06-19 15:30:35
557;FreshMart Fashion Autumn Flash Sale – Week 36 (SE) 2025;1;https://example.com/campaigns/557;https://example.com/images/campaign-557.jpg;2026-02-06 13:45:17
558;SportZone Home & Living Spring New Arrivals – Week 48 (CH) 2026;1;https://example.com/campaigns/558;https://example.com/images/campaign-558.jpg;2025-06-03 12:34:21
559;StyleHub Beauty Summer New Arrivals – Week 42 (AT) 2026;1;https://example.com/campaigns/559;https://example.com/images/campaign-559.jpg;2026-06-10 08:36:05
560;DailySave Pets Autumn Mega Savings – Week 38 (NL) 2025;1;https://example.com/campaigns/560;https://example.com/images/campaign-560.jpg;2025-02-12 14:51:36
561;TechWorld Beauty Spring Weekend Deals – Week 14 (DE) 2026;1;https://example.com/campaigns/561;https://example.com/images/campaign-561.jpg;2026-07-07 23:51:52
562;FreshMart Fashion Spring Limited Time – Week 51 (IT) 2025;1;https://example.com/campaigns/562;https://example.com/images/campaign-562.jpg;2026-12-17 08:30:00
563;BuildIt Home & Living Winter Flash Sale – Week 49 (NL) 2026;0;https://example.com/campaigns/563;https://example.com/images/campaign-563.jpg;2025-05-16 19:18:07
564;PetPal DIY Autumn New Arrivals – Week 31 (ES) 2026;0;https://example.com/campaigns/564;https://example.com/images/campaign-564.jpg;2025-02-26 08:01:37
565;DailySave Electronics Autumn Member Offer – Week 15 (DE) 2025;1;https://example.com/campaigns/565;https://example.com/images/campaign-565.jpg;2025-07-13 23:55:17
566;StyleHub Beauty Spring Mega Savings – Week 42 (DE) 2025;1;https://example.com/campaigns/566;https://example.com/images/campaign-566.jpg;2026-08-22 06:15:47
567;BuildIt Pharmacy Autumn Weekend Deals – Week 26 (DE) 2026;0;https://example.com/campaigns/567;https://example.com/images/campaign-567.jpg;2025-08-23 08:24:12
568;TechWorld Pets Spring Flash Sale – Week 23 (NL) 2025;0;https://example.com/campaigns/568;https://example.com/images/campaign-568.jpg;2025-02-19 15:49:25
569;FreshMart DIY Winter Weekend Deals – Week 2 (ES) 2025;0;https://example.com/campaigns/569;https://example.com/images/campaign-569.jpg;2025-09-12 09:23:20
570;StyleHub Pets Autumn Member Offer – Week 49 (ES) 2026;1;https://example.com/campaigns/570;https://example.com/images/campaign-570.jpg;2026-06-01 12:54:05
571;PetPal Home & Living Summer Weekend Deals – Week 29 (UK) 2025;0;https://example.com/campaigns/571;https://example.com/images/campaign-571.jpg;2026-01-01 23:26:57
572;DailySave Beauty Spring Weekend Deals – Week 35 (DE) 2026;1;https://example.com/campaigns/572;https://example.com/images/campaign-572.jpg;2026-08-03 00:02:45
573;SportZone Beauty Autumn Clearance – Week 51 (ES) 2026;1;https://example.com/campaigns/573;https://example.com/images/campaign-573.jpg;2025-07-31 23:58:48
574;HomePro Home & Living Autumn Mega Savings – Week 30 (IT) 2025;1;https://example.com/campaigns/574;https://example.com/images/campaign-574.jpg;2025-08-01 08:24:26
575;StyleHub Grocery Winter New Arrivals – Week 11 (UK) 2025;0;https://example.com/campaigns/575;https://example.com/images/campaign-575.jpg;2026-12-21 19:56:20
576;TechWorld Sports Summer Member Offer – Week 49 (FR) 2026;1;https://example.com/campaigns/576;https://example.com/images/campaign-576.jpg;2026-07-02 15:51:53
577;PetPal Beauty Spring Weekend Deals – Week 14 (PL) 2026;0;https://example.com/campaigns/577;https://example.com/images/campaign-577.jpg;2026-08-23 09:59:40
578;StyleHub Grocery Summer New Arrivals – Week 8 (AT) 2025;0;https://example.com/campaigns/578;https://example.com/images/campaign-578.jpg;2026-07-31 03:36:53
579;TechWorld Home & Living Summer Mega Savings – Week 5 (DE) 2026;1;https://example.com/campaigns/579;https://example.com/images/campaign-579.jpg;2025-10-10 16:18:26
580;TechWorld Electronics Summer Price Drop – Week 1 (CH) 2026;1;https://example.com/campaigns/580;https://example.com/images/campaign-580.jpg;2025-03-03 10:44:36
581;DailySave DIY Summer Mega Savings – Week 33 (SE) 2026;1;https://example.com/campaigns/581;https://example.com/images/campaign-581.jpg;2026-10-17 05:30:57
582;BuildIt Beauty Autumn Member Offer – Week 30 (FR) 2025;1;https://example.com/campaigns/582;https://example.com/images/campaign-582.jpg;2026-12-13 17:54:33
583;DailySave Electronics Winter Flash Sale – Week 34 (ES) 2026;0;https://example.com/campaigns/583;https://example.com/images/campaign-583.jpg;2026-08-07 04:54:37
584;DailySave Sports Spring Price Drop – Week 52 (FR) 2026;1;https://example.com/campaigns/584;https://example.com/images/campaign-584.jpg;2026-08-02 23:57:19
585;TechWorld Fashion Spring New Arrivals – Week 5 (CH) 2025;0;https://example.com/campaigns/585;https://example.com/images/campaign-585.jpg;2026-03-04 10:57:59
586;SportZone Electronics Autumn Weekend Deals – Week 37 (DE) 2026;1;https://example.com/campaigns/586;https://example.com/images/campaign-586.jpg;2026-12-12 10:12:00
587;BeautyBox Sports Winter Clearance – Week 17 (IT) 2025;1;https://example.com/campaigns/587;https://example.com/images/campaign-587.jpg;2025-03-19 16:02:41
588;DailySave Fashion Spring Mega Savings – Week 3 (PL) 2026;1;https://example.com/campaigns/588;https://example.com/images/campaign-588.jpg;2026-12-14 00:04:10
589;HomePro Pharmacy Winter Limited Time – Week 21 (SE) 2025;0;https://example.com/campaigns/589;https://example.com/images/campaign-589.jpg;2025-01-02 22:00:33
590;HomePro Pets Autumn Weekend Deals – Week 21 (AT) 2026;1;https://example.com/campaigns/590;https://example.com/images/campaign-590.jpg;2026-11-19 02:34:27
591;DailySave Beauty Winter Price Drop – Week 21 (CH) 2025;0;https://example.com/campaigns/591;https://example.com/images/campaign-591.jpg;2025-11-22 07:54:30
592;DailySave Pharmacy Autumn Weekend Deals – Week 12 (SE) 2026;0;https://example.com/campaigns/592;https://example.com/images/campaign-592.jpg;2026-08-08 21:15:19
593;HomePro Grocery Spring Hot Picks – Week 50 (AT) 2025;1;https://example.com/campaigns/593;https://example.com/images/campaign-593.jpg;2025-11-19 12:49:44
594;SportZone Electronics Autumn Hot Picks – Week 14 (AT) 2026;1;https://example.com/campaigns/594;https://example.com/images/campaign-594.jpg;2025-06-17 20:50:46
595;StyleHub Fashion Summer Mega Savings – Week 27 (FR) 2025;1;https://example.com/campaigns/595;https://example.com/images/campaign-595.jpg;2025-08-01 12:09:53
596;BuildIt Sports Autumn Member Offer – Week 37 (FR) 2025;1;https://example.com/campaigns/596;https://example.com/images/campaign-596.jpg;2025-12-07 16:07:37
597;SportZone Grocery Summer New Arrivals – Week 50 (ES) 2025;0;https://example.com/campaigns/597;https://example.com/images/campaign-597.jpg;2025-01-12 18:04:54
598;TechWorld Fashion Summer Limited Time – Week 13 (SE) 2026;1;https://example.com/campaigns/598;https://example.com/images/campaign-598.jpg;2026-12-29 12:09:56
599;PetPal DIY Summer Hot Picks – Week 30 (AT) 2025;0;https://example.com/campaigns/599;https://example.com/images/campaign-599.jpg;2025-10-02 08:16:13
600;PetPal DIY Autumn Clearance – Week 10 (NL) 2026;0;https://example.com/campaigns/600;https://example.com/images/campaign-600.jpg;2026-08-30 09:34:18
601;BuildIt Beauty Summer Price Drop – Week 3 (PL) 2026;1;https://example.com/campaigns/601;https://example.com/images/campaign-601.jpg;2025-09-23 12:53:20
602;SportZone Sports Summer Weekend Deals – Week 27 (NL) 2025;1;https://example.com/campaigns/602;https://example.com/images/campaign-602.jpg;2025-11-19 00:10:33
603;StyleHub Home & Living Spring Hot Picks – Week 33 (DE) 2026;0;https://example.com/campaigns/603;https://example.com/images/campaign-603.jpg;2026-12-25 22:22:56
604;HomePro DIY Winter Flash Sale – Week 51 (DE) 2025;0;https://example.com/campaigns/604;https://example.com/images/campaign-604.jpg;2025-11-02 07:16:29
605;BeautyBox Pharmacy Winter Member Offer – Week 11 (SE) 2025;0;https://example.com/campaigns/605;https://example.com/images/campaign-605.jpg;2025-07-13 01:09:56
606;PetPal Pets Winter Clearance – Week 26 (NL) 2025;1;https://example.com/campaigns/606;https://example.com/images/campaign-606.jpg;2025-04-15 09:18:12
607;DailySave Beauty Autumn Mega Savings – Week 21 (NL) 2026;0;https://example.com/campaigns/607;https://example.com/images/campaign-607.jpg;2026-05-19 09:41:57
608;DailySave Home & Living Spring Price Drop – Week 29 (DE) 2026;1;https://example.com/campaigns/608;https://example.com/images/campaign-608.jpg;2026-04-13 23:29:55
609;FreshMart DIY Summer Flash Sale – Week 46 (PL) 2026;1;https://example.com/campaigns/609;https://example.com/images/campaign-609.jpg;2025-11-22 06:37:47
610;SportZone DIY Summer Hot Picks – Week 8 (FR) 2025;0;https://example.com/campaigns/610;https://example.com/images/campaign-610.jpg;2025-02-17 04:37:54
611;PetPal DIY Summer Clearance – Week 5 (CH) 2025;1;https://example.com/campaigns/611;https://example.com/images/campaign-611.jpg;2026-08-31 22:59:47
612;DailySave Sports Summer Flash Sale – Week 9 (IT) 2025;1;https://example.com/campaigns/612;https://example.com/images/campaign-612.jpg;2025-01-04 06:47:38
613;StyleHub Pharmacy Spring Clearance – Week 26 (CH) 2026;1;https://example.com/campaigns/613;https://example.com/images/campaign-613.jpg;2025-04-30 01:48:15
614;FreshMart DIY Winter Price Drop – Week 29 (IT) 2026;0;https://example.com/campaigns/614;https://example.com/images/campaign-614.jpg;2025-12-11 08:26:29
615;BeautyBox Grocery Summer Price Drop – Week 21 (UK) 2025;0;https://example.com/campaigns/615;https://example.com/images/campaign-615.jpg;2026-10-18 10:22:46
616;PetPal Grocery Autumn Weekend Deals – Week 5 (IT) 2026;1;https://example.com/campaigns/616;https://example.com/images/campaign-616.jpg;2026-03-30 02:06:33
617;FreshMart Electronics Winter Member Offer – Week 16 (SE) 2026;1;https://example.com/campaigns/617;https://example.com/images/campaign-617.jpg;2026-05-09 18:08:09
618;SportZone Sports Spring Flash Sale – Week 8 (ES) 2026;1;https://example.com/campaigns/618;https://example.com/images/campaign-618.jpg;2026-01-30 15:54:59
619;DailySave Fashion Autumn Hot Picks – Week 34 (UK) 2026;1;https://example.com/campaigns/619;https://example.com/images/campaign-619.jpg;2026-07-10 17:16:52
620;FreshMart Fashion Spring Member Offer – Week 5 (FR) 2026;1;https://example.com/campaigns/620;https://example.com/images/campaign-620.jpg;2025-12-01 04:04:35
621;DailySave DIY Spring Limited Time – Week 44 (DE) 2026;0;https://example.com/campaigns/621;https://example.com/images/campaign-621.jpg;2026-09-12 06:39:16
622;DailySave Home & Living Winter New Arrivals – Week 5 (SE) 2025;0;https://example.com/campaigns/622;https://example.com/images/campaign-622.jpg;2026-02-21 15:38:07
623;BeautyBox DIY Spring Member Offer – Week 27 (CH) 2026;1;https://example.com/campaigns/623;https://example.com/images/campaign-623.jpg;2025-07-11 10:57:55
624;DailySave Pharmacy Spring Mega Savings – Week 52 (DE) 2025;1;https://example.com/campaigns/624;https://example.com/images/campaign-624.jpg;2026-11-20 20:36:44
625;MarketPlus Beauty Autumn Price Drop – Week 17 (AT) 2025;1;https://example.com/campaigns/625;https://example.com/images/campaign-625.jpg;2026-03-29 22:23:07
626;TechWorld Fashion Spring Flash Sale – Week 35 (IT) 2026;1;https://example.com/campaigns/626;https://example.com/images/campaign-626.jpg;2026-05-22 01:57:57
627;PetPal Pharmacy Winter Limited Time – Week 9 (AT) 2026;1;https://example.com/campaigns/627;https://example.com/images/campaign-627.jpg;2025-05-24 02:09:41
628;DailySave Home & Living Summer Flash Sale – Week 25 (UK) 2025;1;https://example.com/campaigns/628;https://example.com/images/campaign-628.jpg;2025-04-24 22:18:58
629;StyleHub Beauty Spring New Arrivals – Week 3 (SE) 2026;1;https://example.com/campaigns/629;https://example.com/images/campaign-629.jpg;2025-07-09 09:16:23
630;DailySave Pharmacy Autumn Weekend Deals – Week 37 (AT) 2025;0;https://example.com/campaigns/630;https://example.com/images/campaign-630.jpg;2025-06-29 03:27:16
631;DailySave Home & Living Spring Limited Time – Week 17 (NL) 2026;1;https://example.com/campaigns/631;https://example.com/images/campaign-631.jpg;2026-02-14 01:54:41
632;MarketPlus Pharmacy Winter Clearance – Week 45 (DE) 2025;0;https://example.com/campaigns/632;https://example.com/images/campaign-632.jpg;2025-08-08 06:38:06
633;HomePro Home & Living Winter Flash Sale – Week 44 (FR) 2026;1;https://example.com/campaigns/633;https://example.com/images/campaign-633.jpg;2025-04-16 17:03:33
634;FreshMart Pets Autumn Limited Time – Week 1 (FR) 2025;1;https://example.com/campaigns/634;https://example.com/images/campaign-634.jpg;2025-02-11 20:18:19
635;HomePro Fashion Summer Flash Sale – Week 31 (SE) 2026;1;https://example.com/campaigns/635;https://example.com/images/campaign-635.jpg;2025-07-14 07:06:34
636;DailySave Grocery Summer Limited Time – Week 38 (AT) 2026;0;https://example.com/campaigns/636;https://example.com/images/campaign-636.jpg;2026-01-08 12:53:06
637;BuildIt Pets Winter Mega Savings – Week 45 (CH) 2026;1;https://example.com/campaigns/637;https://example.com/images/campaign-637.jpg;2025-06-01 21:35:12
638;BeautyBox DIY Winter Mega Savings – Week 25 (AT) 2025;1;https://example.com/campaigns/638;https://example.com/images/campaign-638.jpg;2025-07-01 05:20:56
